[
    {
        "id": "1fca729e-ff2f-4a50-80f8-929c002d5019",
        "port": "quem me dera",
        "fr": {
            "translation": "j'en rêve - si seulement...",
            "note": "todo"
        },
        "en": {
            "translation": "I wish - if only...",
            "note": "todo"
        },
        "user_usefulness": 2
    },
    {
        "id": "79d10b1b-1696-4077-9b08-fd120b721095",
        "port": "seguir em frente",
        "fr": {
            "translation": "laisser tomber - aller de l'avant",
            "note": "todo"
        },
        "en": {
            "translation": "to move on - to go forward",
            "note": "todo"
        },
        "user_usefulness": 2
    },
    {
        "id": "bb495013-5529-463f-8b7c-42055d8c8dcd",
        "port": "dar um jeito",
        "fr": {
            "translation": "trouver une solution - s'arranger",
            "note": "todo"
        },
        "en": {
            "translation": "to find a way - to work it out",
            "note": "todo"
        },
        "user_usefulness": 2
    },
    {
        "id": "1247a522-6334-46e2-8a32-576aa35f02e6",
        "port": "pegando o jeito",
        "fr": {
            "translation": "prendre l'habitude de - maîtriser",
            "note": "todo"
        },
        "en": {
            "translation": "getting the hang of - mastering",
            "note": "todo"
        },
        "user_usefulness": 2
    },
    {
        "id": "309aa3f3-7a58-441d-b804-2baf4ee4c480",
        "port": "ar livre",
        "fr": {
            "translation": "dehors - en plein air",
            "note": "todo"
        },
        "en": {
            "translation": "outdoors - open air",
            "note": "todo"
        },
        "user_usefulness": 2
    },
    {
        "id": "25f3242b-89c2-4ad7-a8db-1e828aa6420e",
        "port": "deve ser/estar",
        "fr": {
            "translation": "ça doit être - sembler",
            "note": "todo"
        },
        "en": {
            "translation": "it must be - to seem",
            "note": "todo"
        },
        "user_usefulness": 2
    },
    {
        "id": "ccb7cd50-896c-4988-99fa-bcecaf28e85f",
        "port": "estar com saudades",
        "fr": {
            "translation": "avoir la nostalgie de - manquer",
            "note": "todo"
        },
        "en": {
            "translation": "to miss (someone/something)",
            "note": "todo"
        },
        "user_usefulness": 2
    },
    {
        "id": "8990f02c-ad63-4dd6-9c67-2b3287dc6807",
        "port": "fazer falta",
        "fr": {
            "translation": "manquer à quelqu'un",
            "note": "todo"
        },
        "en": {
            "translation": "to be missed",
            "note": "todo"
        },
        "user_usefulness": 2
    },
    {
        "id": "b2c3d4e5-f6a7-8901-7890-123456789012",
        "port": "Tudo bem",
        "fr": {
            "translation": "Comment allez-vous",
            "note": "todo"
        },
        "en": {
            "translation": "How are you",
            "note": "todo"
        },
        "user_usefulness": 2
    },
    {
        "id": "8c0f4ae7-4136-4105-8a6d-b97a0d06e699",
        "port": "de quem",
        "fr": {
            "translation": "à qui/de qui",
            "note": "todo"
        },
        "en": {
            "translation": "whose/from whom",
            "note": "todo"
        },
        "user_usefulness": 2
    },
    {
        "id": "c7d8e9f0-a1b2-3456-1234-567890123456",
        "port": "Prazer em conhecê-lo",
        "fr": {
            "translation": "Enchanté de vous rencontrer",
            "note": "todo"
        },
        "en": {
            "translation": "Nice to meet you",
            "note": "todo"
        },
        "user_usefulness": 2
    },
    {
        "id": "97099832-ae5c-4a16-b843-f6efc5b21b0a",
        "port": "ficar com",
        "fr": {
            "translation": "garder - rester avec",
            "note": "todo"
        },
        "en": {
            "translation": "to keep - to stay with",
            "note": "todo"
        },
        "user_usefulness": 2
    },
    {
        "id": "f545a126-8fbe-4581-b497-64e0427caaa7",
        "port": "ficar de olho",
        "fr": {
            "translation": "garder un œil sur - surveiller",
            "note": "todo"
        },
        "en": {
            "translation": "to keep an eye on - to watch",
            "note": "todo"
        },
        "user_usefulness": 2
    },
    {
        "id": "113845fb-35e9-49d3-b437-411a7adc0abc",
        "port": "obrigado pelo...",
        "fr": {
            "translation": "merci pour...",
            "note": "todo"
        },
        "en": {
            "translation": "thanks for...",
            "note": "todo"
        },
        "user_usefulness": 2
    }
]